num,date,name,url,desc,type
109,"July 22, 2022",Notes on Camp,https://www.thisamericanlife.org/109/notes-on-camp,"People who love summer camp say that non-camp people simply don't understand what's so amazing about it. We attempt to bridge this gap of misunderstanding between camp people and non-camp people.
",Current
400,"July 15, 2022",Stories Pitched by Our Parents,https://www.thisamericanlife.org/400/stories-pitched-by-our-parents,We try to turn their random ideas into actual stories.,Recently aired
775,"July 8, 2022",The Possum Experiment,https://www.thisamericanlife.org/775/the-possum-experiment,An investigation into a very basic question about people: Are most of us bad or good?,Recently aired
774,"July 1, 2022",The Pink House at the Center of the World,https://www.thisamericanlife.org/774/the-pink-house-at-the-center-of-the-world,"Stories from the center of this moment of history, the day it happened.",Recently aired
